{
  "$schema": "./schema/component.schema.json",
  "name": "PULoader",
  "category": "indicators",
  "description": "Spinning activity indicator used to signal background work. Light and Dark variants suit any surface. Not a standalone loading screen - compose with a background view.",
  "platforms": ["web", "ios", "android"],
  "implementation": {
    "web": { "status": "implemented", "sourceFile": "src/components/ui/PULoader.tsx" },
    "ios": { "status": "implemented", "sourceFile": "PurpleUI-iOS/Sources/PurpleUI/Components/PULoader.swift" },
    "android": { "status": "implemented", "sourceFile": "PurpleUI-Android/purpleui/src/main/kotlin/ai/purple/purpleui/components/PULoader.kt" }
  },
  "variants": {
    "kind": "propEnum",
    "propName": "variant",
    "values": ["light", "dark"]
  },
  "props": [
    {
      "name": "variant",
      "type": "\"light\" | \"dark\"",
      "default": "light",
      "description": "light = purple spinner for white/light surfaces | dark = white spinner for navy/dark surfaces",
      "platforms": {
        "ios": "variant: PULoaderVariant (.light | .dark)",
        "android": "variant: PULoaderVariant (Light | Dark)"
      }
    }
  ],
  "tokens": {
    "variants": {
      "light": {
        "color": "colors.brand (#7458FD)",
        "track": "colors.loaderTrack (#DDDDDF)"
      },
      "dark": {
        "color": "#FFFFFF",
        "track": "rgba(255,255,255,0.2)"
      }
    }
  },
  "behaviour": [
    "Full-screen loading: center in a ZStack/Box over the page background",
    "Inline loading: PUButton has a built-in loading prop - prefer that over composing PULoader manually"
  ],
  "accessibility": {
    "role": "progressbar",
    "notes": "announce 'Loading' via accessibilityLabel when displayed as a full-screen state"
  },
  "docPage": "/indicators/loader"
}
